{
  "assumptions": {
    "bytes": 1012,
    "path": "workspace/notes/assumptions.md",
    "sha256": "0526f02c7ebc3f125675f1a47507f21786abfde76a3177a1f36902fdd3885b02"
  },
  "baseline_profile": {
    "bytes": 3968,
    "path": "baseline_profile.json",
    "sha256": "768688efd4ef3fd21bf7007d40532dfde77f0699401373371f2dfae75f848792"
  },
  "contract_version": "artifact-inventory-v2.0.0",
  "coverage_ledger": {
    "bytes": 18962,
    "path": "workspace/rules/coverage.json",
    "sha256": "86308df985a8164ab446c061e2990135147c6d18d3952cf6fc6570ec97650f8e"
  },
  "data_files": [
    {
      "bytes": 6354,
      "path": "workspace/data/o6_17_reference_data.json",
      "sha256": "c9939ac94b3bfb468dd546e7335bd67bd61e25d3c3fbc56d4aa24cc5ced9f59f"
    }
  ],
  "data_inventory": {
    "bytes": 1382,
    "path": "workspace/rules/data_inventory.json",
    "sha256": "cfd5e2d57897de515637dcb9e12e6e0babd683177690e0b9a8a278178d4206fc"
  },
  "direct_profile_diff": {
    "bytes": 52,
    "path": "artifacts/direct-profile-diff.json",
    "sha256": "5baf627f1b87f614244a071d13a325939385f75848b24598fe919f9c7a7f3ee0"
  },
  "grounding_validation": {
    "bytes": 344,
    "path": "artifacts/grounding-validation.json",
    "sha256": "0a3adc732920acf497a6b07009d6a76704761c8ba3bf0fca31f491fb72219590"
  },
  "profile_changes": {
    "bytes": 4126,
    "path": "workspace/rules/profile_changes.json",
    "sha256": "fc64688bc1f4a41456194efd698e019c29935c7a65291a9266b96cd973028894"
  },
  "profile_diff": {
    "bytes": 2507,
    "path": "artifacts/profile-diff.json",
    "sha256": "0e8b42866cc49c6af823b560d4a3b1e74659b3cbbb6b204189529a1f2db103d5"
  },
  "proposed_profile": {
    "bytes": 6086,
    "path": "artifacts/proposed-profile.json",
    "sha256": "590a9b65417387ce8731e62ecbf1ad3c4f300f8f7428acca5d68c73f3601c3aa"
  },
  "raw_log": {
    "bytes": 531848,
    "path": "raw/events.jsonl",
    "sha256": "964273c9413e756d21e7ff33f973ddbfe0398d9eb8f0780870711e898360f532"
  },
  "rego_modules": [
    {
      "bytes": 6034,
      "path": "workspace/policy/o6_17.rego",
      "sha256": "a1d81b1c99a2e43121814a0159ba6f6cf5a49e3238f99be11341e2fde8cb030e"
    }
  ],
  "rego_tests": [
    {
      "bytes": 2985,
      "path": "workspace/tests/o6_17_test.rego",
      "sha256": "ed8590041535c0fae830dec948a3dc19ff002f74ff115fb0bca934bc2d2168e8"
    }
  ],
  "run_id": "v2-o6_17-terra-high-20260925",
  "source_files": [
    {
      "bytes": 2112561,
      "path": "workspace/sources/20241011_srl_oepul_2023.pdf",
      "sha256": "b9b8daabcde20d6dd3dfa58987aee5c481d8993fe4b6c752fe778bc9468d4798"
    },
    {
      "bytes": 287249,
      "path": "workspace/sources/20241011_srl_oepul_2023.txt",
      "sha256": "00c3e164975a851462658df32ceac1f06e35fbb156380fde44258a328b8f6dd1"
    },
    {
      "bytes": 4459467,
      "path": "workspace/sources/20241011_srl_oepul_2023_anhaenge.pdf",
      "sha256": "1f608a5a43f1f93df5f8fd542233b37d312d11fd5d0fa5164d3bd8d4b60a119a"
    },
    {
      "bytes": 294206,
      "path": "workspace/sources/20241011_srl_oepul_2023_anhaenge.txt",
      "sha256": "b2916c977823699b05df15daadd8a10ad169e1e87932b97ad0809e20912d27b0"
    },
    {
      "bytes": 34757,
      "path": "workspace/sources/2026-05-22__trockenheitsbedingte-ausnahmeregelungen-fuer-oepul-biodiversitaetsflaechen.html",
      "sha256": "337f679255d85af31a4d55039b448420158e0647fd3f279153c0d67f4ec3e4b8"
    },
    {
      "bytes": 27896,
      "path": "workspace/sources/2026-06-12__vorzeitiger-ausstieg-aus-der-oepul-massnahme-insektizidverzicht-wein-obst-und-hopfen-fuer-weinbaubetriebe-aufgrund-des-befallsdrucks-durch-die-amerikanische-rebzikade-moeglich.html",
      "sha256": "be5ae0458262511e840119e8e654f2b1331f510da87fe97506e38d49cb19bed4"
    },
    {
      "bytes": 29357,
      "path": "workspace/sources/2026-08-05__duerre-2026-erleichterungen-bei-oepul-und-bei-der-ausgleichszulage.html",
      "sha256": "6766adb41b9ae176b9aafb1db390f67bd25cbfcc9ce249012bbfc0d7b60acca4"
    },
    {
      "bytes": 29067,
      "path": "workspace/sources/2026-08-12__duerre-2026-erleichterungen-in-der-oepul-foerderungsabwicklung.html",
      "sha256": "661072233da37d1ac62aba860e36173e83c98c85119bc6170c0a27dd7d7e435c"
    },
    {
      "bytes": 308908,
      "path": "workspace/sources/o6_17_humuserhalt_und_bodenschutz_auf_umbruchsfaehigem-gruenland_2025_10.pdf",
      "sha256": "882f4cd7c87e18699fc9a7cf237a10845ad7784f73ed25d6af60a1dc96e00ead"
    },
    {
      "bytes": 26141,
      "path": "workspace/sources/o6_17_humuserhalt_und_bodenschutz_auf_umbruchsfaehigem-gruenland_2025_10.txt",
      "sha256": "8e26a2aa7d1804fedfa8c952242267b8b6aa9e03b740d9e6737dba665d7e309b"
    },
    {
      "bytes": 416598,
      "path": "workspace/sources/o6_allgemeine_teilnahmebedingungen_2026_04.pdf",
      "sha256": "89ad678a94ad109f6ba92563be4650dd0d36a6f3599506a187b56b1398dca120"
    },
    {
      "bytes": 50223,
      "path": "workspace/sources/o6_allgemeine_teilnahmebedingungen_2026_04.txt",
      "sha256": "7b9c46ec71ed53282c8dc8e8053e3abf2174d7001d3373c884b898e1822fb3ed"
    }
  ],
  "source_references": {
    "bytes": 21694,
    "path": "workspace/rules/citations.json",
    "sha256": "eb9c7897a712f5ed9a91f1b4f28fb1f77eb8982f7fae09767e8a342a7cdcc957"
  },
  "structured_rules": {
    "bytes": 24183,
    "path": "workspace/rules/rules.json",
    "sha256": "85b7248e156f0a7e21378e9533b8dbabb3163de72cd137977c83d708d912722e"
  },
  "working_profile": {
    "bytes": 3968,
    "path": "workspace/canonical_farm_profile.json",
    "sha256": "768688efd4ef3fd21bf7007d40532dfde77f0699401373371f2dfae75f848792"
  }
}
