{
  "assumptions": {
    "bytes": 2292,
    "path": "workspace/notes/assumptions.md",
    "sha256": "dc07791d81cf12abd8ae7da455a0e0d1462fc674da850322ad591eb6b7b85e02"
  },
  "baseline_profile": {
    "bytes": 3968,
    "path": "baseline_profile.json",
    "sha256": "768688efd4ef3fd21bf7007d40532dfde77f0699401373371f2dfae75f848792"
  },
  "contract_version": "artifact-inventory-v2.0.0",
  "coverage_ledger": {
    "bytes": 13528,
    "path": "workspace/rules/coverage.json",
    "sha256": "00a3576a4008f1b840ab8f83b4afa6edd4cf1ac1e8b4be8eec1a25257097ee95"
  },
  "data_files": [
    {
      "bytes": 3496,
      "path": "workspace/data/o6_11_reference_tables.json",
      "sha256": "2728d8d7b57be5bffab0d0c96f8ff2d58bbd351317f7bf33a7c6a478a81b1c50"
    }
  ],
  "data_inventory": {
    "bytes": 1797,
    "path": "workspace/rules/data_inventory.json",
    "sha256": "fdf10141a27e02c01cdc4e06ea0c943cdc8adf82b0b75951d327e08aaee215f3"
  },
  "direct_profile_diff": {
    "bytes": 52,
    "path": "artifacts/direct-profile-diff.json",
    "sha256": "5baf627f1b87f614244a071d13a325939385f75848b24598fe919f9c7a7f3ee0"
  },
  "grounding_validation": {
    "bytes": 344,
    "path": "artifacts/grounding-validation.json",
    "sha256": "0a3adc732920acf497a6b07009d6a76704761c8ba3bf0fca31f491fb72219590"
  },
  "profile_changes": {
    "bytes": 5422,
    "path": "workspace/rules/profile_changes.json",
    "sha256": "896d58c81b7b491b222c009fc6befceae8d5d72eab3beb3f64bce8b2adf627c3"
  },
  "profile_diff": {
    "bytes": 2063,
    "path": "artifacts/profile-diff.json",
    "sha256": "10273dbd201de34c793cd15181a5ec6e0aa92c3bab9c6d8c62e68b06a0625b91"
  },
  "proposed_profile": {
    "bytes": 5514,
    "path": "artifacts/proposed-profile.json",
    "sha256": "b07bb40e00d4312e32e58b0de859bdd8f90bee95a27b37239c5db1140198ea16"
  },
  "raw_log": {
    "bytes": 538140,
    "path": "raw/events.jsonl",
    "sha256": "e6527832e9fc9097e8ffaf6f6761b02dec42b3728038c9a01a724a708d4faf68"
  },
  "rego_modules": [
    {
      "bytes": 6567,
      "path": "workspace/policy/o6_11.rego",
      "sha256": "7f26bc62e947da1902f6e346fa5fcae95f1ea3f2b1f0cf62d6220ba65412c6b6"
    }
  ],
  "rego_tests": [
    {
      "bytes": 3434,
      "path": "workspace/tests/o6_11_test.rego",
      "sha256": "87068e7bb4657afff6ccd837eb002d455a828493ea39a7ad6cf36a5762f9ddd2"
    }
  ],
  "run_id": "v2-o6_11-luna-20260920",
  "source_files": [
    {
      "bytes": 2112561,
      "path": "workspace/sources/20241011_srl_oepul_2023.pdf",
      "sha256": "b9b8daabcde20d6dd3dfa58987aee5c481d8993fe4b6c752fe778bc9468d4798"
    },
    {
      "bytes": 287249,
      "path": "workspace/sources/20241011_srl_oepul_2023.txt",
      "sha256": "00c3e164975a851462658df32ceac1f06e35fbb156380fde44258a328b8f6dd1"
    },
    {
      "bytes": 4459467,
      "path": "workspace/sources/20241011_srl_oepul_2023_anhaenge.pdf",
      "sha256": "1f608a5a43f1f93df5f8fd542233b37d312d11fd5d0fa5164d3bd8d4b60a119a"
    },
    {
      "bytes": 294206,
      "path": "workspace/sources/20241011_srl_oepul_2023_anhaenge.txt",
      "sha256": "b2916c977823699b05df15daadd8a10ad169e1e87932b97ad0809e20912d27b0"
    },
    {
      "bytes": 34757,
      "path": "workspace/sources/2026-05-22__trockenheitsbedingte-ausnahmeregelungen-fuer-oepul-biodiversitaetsflaechen.html",
      "sha256": "337f679255d85af31a4d55039b448420158e0647fd3f279153c0d67f4ec3e4b8"
    },
    {
      "bytes": 27896,
      "path": "workspace/sources/2026-06-12__vorzeitiger-ausstieg-aus-der-oepul-massnahme-insektizidverzicht-wein-obst-und-hopfen-fuer-weinbaubetriebe-aufgrund-des-befallsdrucks-durch-die-amerikanische-rebzikade-moeglich.html",
      "sha256": "be5ae0458262511e840119e8e654f2b1331f510da87fe97506e38d49cb19bed4"
    },
    {
      "bytes": 29357,
      "path": "workspace/sources/2026-08-05__duerre-2026-erleichterungen-bei-oepul-und-bei-der-ausgleichszulage.html",
      "sha256": "6766adb41b9ae176b9aafb1db390f67bd25cbfcc9ce249012bbfc0d7b60acca4"
    },
    {
      "bytes": 29067,
      "path": "workspace/sources/2026-08-12__duerre-2026-erleichterungen-in-der-oepul-foerderungsabwicklung.html",
      "sha256": "661072233da37d1ac62aba860e36173e83c98c85119bc6170c0a27dd7d7e435c"
    },
    {
      "bytes": 281396,
      "path": "workspace/sources/o6_11_herbizidverzicht_wein_obst_hopfen_2026_04.pdf",
      "sha256": "3cbe2c5c271afcc4045eb56658d3457227087dc9e9402cf1b5ba640e1a1f7556"
    },
    {
      "bytes": 7441,
      "path": "workspace/sources/o6_11_herbizidverzicht_wein_obst_hopfen_2026_04.txt",
      "sha256": "2b6b2a5e980da6c0bcf3e7e4a445db31a514100a84090596fe172edb24854c8c"
    },
    {
      "bytes": 416598,
      "path": "workspace/sources/o6_allgemeine_teilnahmebedingungen_2026_04.pdf",
      "sha256": "89ad678a94ad109f6ba92563be4650dd0d36a6f3599506a187b56b1398dca120"
    },
    {
      "bytes": 50223,
      "path": "workspace/sources/o6_allgemeine_teilnahmebedingungen_2026_04.txt",
      "sha256": "7b9c46ec71ed53282c8dc8e8053e3abf2174d7001d3373c884b898e1822fb3ed"
    }
  ],
  "source_references": {
    "bytes": 25975,
    "path": "workspace/rules/citations.json",
    "sha256": "184e6457d9fb9722223a53b3105a5814b1b4cffa15c83d3a2ab3c9203754530d"
  },
  "structured_rules": {
    "bytes": 21781,
    "path": "workspace/rules/rules.json",
    "sha256": "0655085f6bc9d3231384145f446b102bade56b6e1351f3baa35e74ed6104887b"
  },
  "working_profile": {
    "bytes": 3968,
    "path": "workspace/canonical_farm_profile.json",
    "sha256": "768688efd4ef3fd21bf7007d40532dfde77f0699401373371f2dfae75f848792"
  }
}
