{
  "assumptions": {
    "bytes": 5854,
    "path": "workspace/notes/assumptions.md",
    "sha256": "e5575723111a9637c81b401f7f9ccb55b7807774b05ebd95684a2ce32bfcf835"
  },
  "baseline_profile": {
    "bytes": 3968,
    "path": "baseline_profile.json",
    "sha256": "768688efd4ef3fd21bf7007d40532dfde77f0699401373371f2dfae75f848792"
  },
  "contract_version": "artifact-inventory-v2.0.0",
  "coverage_ledger": {
    "bytes": 51031,
    "path": "workspace/rules/coverage.json",
    "sha256": "4ef70648638cb5f54e4942e236e09f8ff8a66943b5618342cd97c5142bcd3794"
  },
  "data_files": [
    {
      "bytes": 26066,
      "path": "workspace/data/o6_17/combination_matrix.json",
      "sha256": "aacc815f7881fba8b7b22cc7645577f3ab9e05255b5874b831fa441829d912fc"
    },
    {
      "bytes": 746,
      "path": "workspace/data/o6_17/contract_periods.json",
      "sha256": "4586038d77df73c622dd20f7c8e8ee6f19cc73b3ffea958bc18cfe0226b05996"
    },
    {
      "bytes": 3751,
      "path": "workspace/data/o6_17/general_tables.json",
      "sha256": "b5a68427797ea90b9a1a2c79617e9d954af0cd1155cb83141f23c551b93ba8d2"
    },
    {
      "bytes": 15675,
      "path": "workspace/data/o6_17/kennarten.json",
      "sha256": "be5b73bb8347cb1ca4ebd39ee87a8a894bdd527edc1e97027d02763d8734d2b4"
    },
    {
      "bytes": 13130,
      "path": "workspace/data/o6_17/lists.json",
      "sha256": "dfa0c69c39192da71f2e331b6e0b8526054337f2dfcf2ed71493baad6ab0f5e5"
    },
    {
      "bytes": 2655,
      "path": "workspace/data/o6_17/premium_rates.json",
      "sha256": "6bcfc8c5c4af4c2c33197ef1baf3d1968f12f5bf77789d6fefcc615011fb9553"
    },
    {
      "bytes": 5526,
      "path": "workspace/data/o6_17/rgve_key.json",
      "sha256": "d4595fa6b1d169713815c4e0bd7aef99af8f7810e258a3fa650a0adc07434866"
    },
    {
      "bytes": 1304,
      "path": "workspace/data/o6_17/thresholds.json",
      "sha256": "4ecf93cf013f609a85b87db32ea306968dc82f1118e20a3289352ef26ae6b48d"
    }
  ],
  "data_inventory": {
    "bytes": 11126,
    "path": "workspace/rules/data_inventory.json",
    "sha256": "b6a143d1d4047aacb65e928ed39651be39c3899b3664b95a37e394d756dac7b6"
  },
  "direct_profile_diff": {
    "bytes": 52,
    "path": "artifacts/direct-profile-diff.json",
    "sha256": "5baf627f1b87f614244a071d13a325939385f75848b24598fe919f9c7a7f3ee0"
  },
  "grounding_validation": {
    "bytes": 344,
    "path": "artifacts/grounding-validation.json",
    "sha256": "0a3adc732920acf497a6b07009d6a76704761c8ba3bf0fca31f491fb72219590"
  },
  "profile_changes": {
    "bytes": 19710,
    "path": "workspace/rules/profile_changes.json",
    "sha256": "7bf7e148d9c02b47ba564c63b7cd10228872fb7270e288d4fe71502d2804c761"
  },
  "profile_diff": {
    "bytes": 5700,
    "path": "artifacts/profile-diff.json",
    "sha256": "0cacb0b3d8ee203dddffc66632eb922b6b6d24be355b7085f3da681a9b39f95c"
  },
  "proposed_profile": {
    "bytes": 8972,
    "path": "artifacts/proposed-profile.json",
    "sha256": "2821525efccade2261dc988cda13e3b0cccf27bde7251fa494a5a4c30bc14f23"
  },
  "raw_log": {
    "bytes": 75986,
    "path": "raw/events.jsonl",
    "sha256": "90f8f5c0d550c4b35973763beffaa12ccc2706d7180780c040e2aca920c57c62"
  },
  "rego_modules": [
    {
      "bytes": 6396,
      "path": "workspace/policy/o6_17/base.rego",
      "sha256": "313c88c42c77ba0ff7b4934ab6c2a553934ed7a485dfb95019bbe747288646ca"
    },
    {
      "bytes": 1416,
      "path": "workspace/policy/o6_17/decision.rego",
      "sha256": "f3a8c6570c14442195a996f18f1464c7fb32bea957253d533a32baeb89c875f7"
    },
    {
      "bytes": 6976,
      "path": "workspace/policy/o6_17/general.rego",
      "sha256": "b57f39c5f29090dee82dbb6951bff6c4a9a1fdfd32f45e7bb41fcdd1d3bdf53e"
    },
    {
      "bytes": 10658,
      "path": "workspace/policy/o6_17/obligations.rego",
      "sha256": "3d324118410f6c0283203b240de8c2a123db9333bcc1663558b2c39f090652fc"
    },
    {
      "bytes": 8733,
      "path": "workspace/policy/o6_17/premium.rego",
      "sha256": "1d30ab3c324b88bff831a22c92b49cf991fbbb37b8058788e51874cf06b8e798"
    }
  ],
  "rego_tests": [
    {
      "bytes": 5886,
      "path": "workspace/tests/o6_17/access_test.rego",
      "sha256": "feddf3f118aab06b1ab4f478ebb0870f8df5a83a42aa63f22f0af0f0279daf03"
    },
    {
      "bytes": 2897,
      "path": "workspace/tests/o6_17/fixtures_test.rego",
      "sha256": "824434b870c39c8647f0826bc454c28119870182b34030f5e31632c6d8aefe65"
    },
    {
      "bytes": 5226,
      "path": "workspace/tests/o6_17/general_test.rego",
      "sha256": "f1090ad8d1349ad1b3ef678da41c624a540b5b3562fb9c2e47e03620ad559715"
    },
    {
      "bytes": 11915,
      "path": "workspace/tests/o6_17/obligations_test.rego",
      "sha256": "6adf466ee5261583976dd3eaba780ca453c24e0057b5fa6eb08eac8c5dd8a04a"
    },
    {
      "bytes": 7778,
      "path": "workspace/tests/o6_17/premium_test.rego",
      "sha256": "db4f753cdae661213ed6cb1cf3e6f70d2886827b340b1417aa60e69933982d47"
    }
  ],
  "run_id": "v2-o6_17-opus-5.5-high-20261002",
  "source_files": [
    {
      "bytes": 2112561,
      "path": "workspace/sources/20241011_srl_oepul_2023.pdf",
      "sha256": "b9b8daabcde20d6dd3dfa58987aee5c481d8993fe4b6c752fe778bc9468d4798"
    },
    {
      "bytes": 287249,
      "path": "workspace/sources/20241011_srl_oepul_2023.txt",
      "sha256": "00c3e164975a851462658df32ceac1f06e35fbb156380fde44258a328b8f6dd1"
    },
    {
      "bytes": 4459467,
      "path": "workspace/sources/20241011_srl_oepul_2023_anhaenge.pdf",
      "sha256": "1f608a5a43f1f93df5f8fd542233b37d312d11fd5d0fa5164d3bd8d4b60a119a"
    },
    {
      "bytes": 294206,
      "path": "workspace/sources/20241011_srl_oepul_2023_anhaenge.txt",
      "sha256": "b2916c977823699b05df15daadd8a10ad169e1e87932b97ad0809e20912d27b0"
    },
    {
      "bytes": 34757,
      "path": "workspace/sources/2026-05-22__trockenheitsbedingte-ausnahmeregelungen-fuer-oepul-biodiversitaetsflaechen.html",
      "sha256": "337f679255d85af31a4d55039b448420158e0647fd3f279153c0d67f4ec3e4b8"
    },
    {
      "bytes": 27896,
      "path": "workspace/sources/2026-06-12__vorzeitiger-ausstieg-aus-der-oepul-massnahme-insektizidverzicht-wein-obst-und-hopfen-fuer-weinbaubetriebe-aufgrund-des-befallsdrucks-durch-die-amerikanische-rebzikade-moeglich.html",
      "sha256": "be5ae0458262511e840119e8e654f2b1331f510da87fe97506e38d49cb19bed4"
    },
    {
      "bytes": 29357,
      "path": "workspace/sources/2026-08-05__duerre-2026-erleichterungen-bei-oepul-und-bei-der-ausgleichszulage.html",
      "sha256": "6766adb41b9ae176b9aafb1db390f67bd25cbfcc9ce249012bbfc0d7b60acca4"
    },
    {
      "bytes": 29067,
      "path": "workspace/sources/2026-08-12__duerre-2026-erleichterungen-in-der-oepul-foerderungsabwicklung.html",
      "sha256": "661072233da37d1ac62aba860e36173e83c98c85119bc6170c0a27dd7d7e435c"
    },
    {
      "bytes": 308908,
      "path": "workspace/sources/o6_17_humuserhalt_und_bodenschutz_auf_umbruchsfaehigem-gruenland_2025_10.pdf",
      "sha256": "882f4cd7c87e18699fc9a7cf237a10845ad7784f73ed25d6af60a1dc96e00ead"
    },
    {
      "bytes": 26141,
      "path": "workspace/sources/o6_17_humuserhalt_und_bodenschutz_auf_umbruchsfaehigem-gruenland_2025_10.txt",
      "sha256": "8e26a2aa7d1804fedfa8c952242267b8b6aa9e03b740d9e6737dba665d7e309b"
    },
    {
      "bytes": 416598,
      "path": "workspace/sources/o6_allgemeine_teilnahmebedingungen_2026_04.pdf",
      "sha256": "89ad678a94ad109f6ba92563be4650dd0d36a6f3599506a187b56b1398dca120"
    },
    {
      "bytes": 50223,
      "path": "workspace/sources/o6_allgemeine_teilnahmebedingungen_2026_04.txt",
      "sha256": "7b9c46ec71ed53282c8dc8e8053e3abf2174d7001d3373c884b898e1822fb3ed"
    }
  ],
  "source_references": {
    "bytes": 370288,
    "path": "workspace/rules/citations.json",
    "sha256": "cc84ca43efcf5064a57ac6994215d70ac1ea220c0a47f0032fb5c59be50068de"
  },
  "structured_rules": {
    "bytes": 119945,
    "path": "workspace/rules/rules.json",
    "sha256": "2a8e1598b60357914b63ae388d89ab1afddb9d785faf87b27f51ff6b14d3d7c0"
  },
  "working_profile": {
    "bytes": 3968,
    "path": "workspace/canonical_farm_profile.json",
    "sha256": "768688efd4ef3fd21bf7007d40532dfde77f0699401373371f2dfae75f848792"
  }
}
